{
  "generated_at": "2026-02-25T15:31:27Z",
  "repo": {
    "owner": "BrunoGao",
    "name": "ljwx-platform",
    "branch": "master",
    "commit": "748007a"
  },
  "totals": {
    "pass": 24,
    "fail": 8,
    "pending": 0,
    "critical": 8,
    "warnings": 0
  },
  "phases": [
    {
      "phase": "00",
      "status": "PASS",
      "pass_rate": 100,
      "critical": 0,
      "warnings": 0,
      "timestamp": "2026-02-25T14:33:24Z",
      "git_commit": "2917122",
      "r09_status": "PENDING"
    },
    {
      "phase": "01",
      "status": "PASS",
      "pass_rate": 100,
      "critical": 0,
      "warnings": 0,
      "timestamp": "2026-02-25T15:31:25Z",
      "git_commit": "748007a",
      "r09_status": "PENDING"
    },
    {
      "phase": "02",
      "status": "PASS",
      "pass_rate": 100,
      "critical": 0,
      "warnings": 0,
      "timestamp": "2026-02-25T15:31:25Z",
      "git_commit": "748007a",
      "r09_status": "PENDING"
    },
    {
      "phase": "03",
      "status": "PASS",
      "pass_rate": 100,
      "critical": 0,
      "warnings": 0,
      "timestamp": "2026-02-25T15:31:25Z",
      "git_commit": "748007a",
      "r09_status": "PENDING"
    },
    {
      "phase": "04",
      "status": "PASS",
      "pass_rate": 100,
      "critical": 0,
      "warnings": 0,
      "timestamp": "2026-02-25T15:31:25Z",
      "git_commit": "748007a",
      "r09_status": "PENDING"
    },
    {
      "phase": "05",
      "status": "PASS",
      "pass_rate": 100,
      "critical": 0,
      "warnings": 0,
      "timestamp": "2026-02-25T15:31:25Z",
      "git_commit": "748007a",
      "r09_status": "PENDING"
    },
    {
      "phase": "06",
      "status": "PASS",
      "pass_rate": 100,
      "critical": 0,
      "warnings": 0,
      "timestamp": "2026-02-25T15:31:25Z",
      "git_commit": "748007a",
      "r09_status": "PENDING"
    },
    {
      "phase": "07",
      "status": "PASS",
      "pass_rate": 100,
      "critical": 0,
      "warnings": 0,
      "timestamp": "2026-02-25T15:31:25Z",
      "git_commit": "748007a",
      "r09_status": "PENDING"
    },
    {
      "phase": "08",
      "status": "FAIL",
      "pass_rate": 0,
      "critical": 1,
      "warnings": 0,
      "timestamp": "2026-02-25T15:31:25Z",
      "git_commit": "748007a",
      "r09_status": "PENDING"
    },
    {
      "phase": "09",
      "status": "FAIL",
      "pass_rate": 0,
      "critical": 1,
      "warnings": 0,
      "timestamp": "2026-02-25T15:31:25Z",
      "git_commit": "748007a",
      "r09_status": "PENDING"
    },
    {
      "phase": "10",
      "status": "PASS",
      "pass_rate": 100,
      "critical": 0,
      "warnings": 0,
      "timestamp": "2026-02-25T15:31:25Z",
      "git_commit": "748007a",
      "r09_status": "PENDING"
    },
    {
      "phase": "11",
      "status": "PASS",
      "pass_rate": 100,
      "critical": 0,
      "warnings": 0,
      "timestamp": "2026-02-25T15:31:25Z",
      "git_commit": "748007a",
      "r09_status": "PENDING"
    },
    {
      "phase": "12",
      "status": "PASS",
      "pass_rate": 100,
      "critical": 0,
      "warnings": 0,
      "timestamp": "2026-02-25T15:31:25Z",
      "git_commit": "748007a",
      "r09_status": "PENDING"
    },
    {
      "phase": "13",
      "status": "FAIL",
      "pass_rate": 0,
      "critical": 1,
      "warnings": 0,
      "timestamp": "2026-02-25T15:31:25Z",
      "git_commit": "748007a",
      "r09_status": "PENDING"
    },
    {
      "phase": "14",
      "status": "PASS",
      "pass_rate": 100,
      "critical": 0,
      "warnings": 0,
      "timestamp": "2026-02-25T15:31:25Z",
      "git_commit": "748007a",
      "r09_status": "PENDING"
    },
    {
      "phase": "15",
      "status": "PASS",
      "pass_rate": 100,
      "critical": 0,
      "warnings": 0,
      "timestamp": "2026-02-25T15:31:25Z",
      "git_commit": "748007a",
      "r09_status": "PENDING"
    },
    {
      "phase": "16",
      "status": "PASS",
      "pass_rate": 100,
      "critical": 0,
      "warnings": 0,
      "timestamp": "2026-02-25T15:31:25Z",
      "git_commit": "748007a",
      "r09_status": "PENDING"
    },
    {
      "phase": "17",
      "status": "PASS",
      "pass_rate": 100,
      "critical": 0,
      "warnings": 0,
      "timestamp": "2026-02-25T15:31:25Z",
      "git_commit": "748007a",
      "r09_status": "PENDING"
    },
    {
      "phase": "18",
      "status": "PASS",
      "pass_rate": 100,
      "critical": 0,
      "warnings": 0,
      "timestamp": "2026-02-25T15:31:25Z",
      "git_commit": "748007a",
      "r09_status": "PENDING"
    },
    {
      "phase": "19",
      "status": "PASS",
      "pass_rate": 100,
      "critical": 0,
      "warnings": 0,
      "timestamp": "2026-02-25T15:31:25Z",
      "git_commit": "748007a",
      "r09_status": "PENDING"
    },
    {
      "phase": "20",
      "status": "PASS",
      "pass_rate": 100,
      "critical": 0,
      "warnings": 0,
      "timestamp": "2026-02-25T15:31:25Z",
      "git_commit": "748007a",
      "r09_status": "PENDING"
    },
    {
      "phase": "21",
      "status": "PASS",
      "pass_rate": 100,
      "critical": 0,
      "warnings": 0,
      "timestamp": "2026-02-25T15:31:25Z",
      "git_commit": "748007a",
      "r09_status": "PENDING"
    },
    {
      "phase": "22",
      "status": "PASS",
      "pass_rate": 100,
      "critical": 0,
      "warnings": 0,
      "timestamp": "2026-02-25T15:31:25Z",
      "git_commit": "748007a",
      "r09_status": "PENDING"
    },
    {
      "phase": "23",
      "status": "FAIL",
      "pass_rate": 0,
      "critical": 1,
      "warnings": 0,
      "timestamp": "2026-02-25T15:31:25Z",
      "git_commit": "748007a",
      "r09_status": "PENDING"
    },
    {
      "phase": "24",
      "status": "PASS",
      "pass_rate": 100,
      "critical": 0,
      "warnings": 0,
      "timestamp": "2026-02-25T15:31:25Z",
      "git_commit": "748007a",
      "r09_status": "PENDING"
    },
    {
      "phase": "25",
      "status": "PASS",
      "pass_rate": 100,
      "critical": 0,
      "warnings": 0,
      "timestamp": "2026-02-25T15:31:25Z",
      "git_commit": "748007a",
      "r09_status": "PENDING"
    },
    {
      "phase": "26",
      "status": "PASS",
      "pass_rate": 100,
      "critical": 0,
      "warnings": 0,
      "timestamp": "2026-02-25T15:31:25Z",
      "git_commit": "748007a",
      "r09_status": "PENDING"
    },
    {
      "phase": "27",
      "status": "PASS",
      "pass_rate": 100,
      "critical": 0,
      "warnings": 0,
      "timestamp": "2026-02-25T15:31:25Z",
      "git_commit": "748007a",
      "r09_status": "PENDING"
    },
    {
      "phase": "28",
      "status": "FAIL",
      "pass_rate": 0,
      "critical": 1,
      "warnings": 0,
      "timestamp": "2026-02-25T15:31:25Z",
      "git_commit": "748007a",
      "r09_status": "PENDING"
    },
    {
      "phase": "29",
      "status": "FAIL",
      "pass_rate": 0,
      "critical": 1,
      "warnings": 0,
      "timestamp": "2026-02-25T15:31:25Z",
      "git_commit": "748007a",
      "r09_status": "PENDING"
    },
    {
      "phase": "30",
      "status": "FAIL",
      "pass_rate": 55.56,
      "critical": 1,
      "warnings": 0,
      "timestamp": "2026-02-25T15:29:46Z",
      "git_commit": "748007a",
      "r09_status": "SKIP"
    },
    {
      "phase": "31",
      "status": "FAIL",
      "pass_rate": 55.56,
      "critical": 1,
      "warnings": 0,
      "timestamp": "2026-02-25T15:30:29Z",
      "git_commit": "748007a",
      "r09_status": "SKIP"
    }
  ],
  "history": [
    {
      "timestamp": "2026-02-25T15:30:29Z",
      "phase": "31",
      "status": "FAIL",
      "pass_rate": 55.56,
      "git_commit": "748007a",
      "critical": 1,
      "warnings": 0
    },
    {
      "timestamp": "2026-02-25T15:29:46Z",
      "phase": "30",
      "status": "FAIL",
      "pass_rate": 55.56,
      "git_commit": "748007a",
      "critical": 1,
      "warnings": 0
    },
    {
      "timestamp": "2026-02-25T15:29:00Z",
      "phase": "29",
      "status": "FAIL",
      "pass_rate": 55.56,
      "git_commit": "748007a",
      "critical": 1,
      "warnings": 0
    },
    {
      "timestamp": "2026-02-25T15:27:58Z",
      "phase": "28",
      "status": "FAIL",
      "pass_rate": 55.56,
      "git_commit": "748007a",
      "critical": 1,
      "warnings": 0
    },
    {
      "timestamp": "2026-02-25T15:27:03Z",
      "phase": "27",
      "status": "PASS",
      "pass_rate": 66.67,
      "git_commit": "748007a",
      "critical": 0,
      "warnings": 0
    },
    {
      "timestamp": "2026-02-25T15:26:11Z",
      "phase": "26",
      "status": "PASS",
      "pass_rate": 66.67,
      "git_commit": "748007a",
      "critical": 0,
      "warnings": 0
    },
    {
      "timestamp": "2026-02-25T15:25:28Z",
      "phase": "25",
      "status": "PASS",
      "pass_rate": 66.67,
      "git_commit": "748007a",
      "critical": 0,
      "warnings": 0
    },
    {
      "timestamp": "2026-02-25T15:24:45Z",
      "phase": "24",
      "status": "PASS",
      "pass_rate": 66.67,
      "git_commit": "748007a",
      "critical": 0,
      "warnings": 0
    },
    {
      "timestamp": "2026-02-25T15:24:04Z",
      "phase": "23",
      "status": "FAIL",
      "pass_rate": 55.56,
      "git_commit": "748007a",
      "critical": 1,
      "warnings": 0
    },
    {
      "timestamp": "2026-02-25T15:23:24Z",
      "phase": "22",
      "status": "PASS",
      "pass_rate": 66.67,
      "git_commit": "748007a",
      "critical": 0,
      "warnings": 0
    },
    {
      "timestamp": "2026-02-25T15:22:45Z",
      "phase": "21",
      "status": "PASS",
      "pass_rate": 66.67,
      "git_commit": "748007a",
      "critical": 0,
      "warnings": 0
    },
    {
      "timestamp": "2026-02-25T15:22:04Z",
      "phase": "20",
      "status": "PASS",
      "pass_rate": 66.67,
      "git_commit": "748007a",
      "critical": 0,
      "warnings": 0
    },
    {